{
  "$schema": "http://json-schema.org/draft-07/schema#",
  "$id": "https://buildbyer.com/schema/event.schema.json",
  "title": "Event",
  "type": "object",
  "additionalProperties": false,
  "required": ["id", "category", "year", "title"],
  "properties": {
    "id": {
      "type": "string",
      "pattern": "^[a-z0-9-]+-\\d{4}(?:-(?:0[1-9]|1[0-2]))?(?:-(?:0[1-9]|[12]\\d|3[01]))?-[a-z0-9-]+$"
    },
    "category": { "type": "string", "pattern": "^[a-z0-9-]+$" },
    "year": { "type": "integer", "minimum": 0, "maximum": 3000 },
    "title": { "type": "string", "minLength": 1 },
    "summary": { "type": "string" },
    "date": { "type": "string", "pattern": "^\\d{4}(-\\d{2}(-\\d{2})?)?$" },
    "location": { "type": "string" },
    "countries": { "type": "array", "items": { "type": "string" } },
    "tags": { "type": "array", "items": { "type": "string" } },
    "meta": { "type": "object", "additionalProperties": true },
    "geo": {
      "type": "object",
      "additionalProperties": false,
      "required": ["lat", "lng"],
      "properties": {
        "lat": { "type": "number", "minimum": -90, "maximum": 90 },
        "lng": { "type": "number", "minimum": -180, "maximum": 180 }
      }
    },
    "punchline": { "type": "string" }
  }
}
