[
  {
    "id": "nato-1949-04-04-treaty",
    "category": "nato",
    "year": 1949,
    "title": "North Atlantic Treaty signed (Washington Treaty)",
    "summary": "12 founding members sign the North Atlantic Treaty in Washington, D.C.",
    "meta": { "members": ["BE","CA","DK","FR","IS","IT","LU","NL","NO","PT","UK","US"] }
  },
  {
    "id": "nato-1949-08-24-entry-into-force",
    "category": "nato",
    "year": 1949,
    "title": "North Atlantic Treaty enters into force",
    "summary": "The treaty becomes legally binding after ratifications are deposited.",
    "meta": {}
  },
  {
    "id": "nato-1950-09-26-mpc",
    "category": "nato",
    "year": 1950,
    "title": "Military Committee becomes permanent",
    "summary": "Permanent military governance structure formalized.",
    "meta": {}
  },
  {
    "id": "nato-1951-02-25-sc",
    "category": "nato",
    "year": 1951,
    "title": "Supreme Headquarters Allied Powers Europe (SHAPE) established",
    "summary": "SHAPE is created with Gen. Dwight D. Eisenhower as first SACEUR.",
    "meta": {}
  },
  {
    "id": "nato-1952-02-18-greece-turkey",
    "category": "nato",
    "year": 1952,
    "title": "Greece and Turkey join NATO",
    "summary": "Alliance expands to 14 members.",
    "meta": { "members_added": ["GR","TR"] }
  },
  {
    "id": "nato-1952-04-04-nac-ministerial",
    "category": "nato",
    "year": 1952,
    "title": "NAC Ministerial practice established",
    "summary": "Regular foreign and defence minister meetings institutionalized.",
    "meta": {}
  },
  {
    "id": "nato-1955-05-09-frg",
    "category": "nato",
    "year": 1955,
    "title": "Federal Republic of Germany accedes",
    "summary": "West Germany becomes a NATO member; Warsaw Pact forms soon after.",
    "meta": { "members_added": ["DEU"] }
  },
  {
    "id": "nato-1956-10-23-suez-hungary",
    "category": "nato",
    "year": 1956,
    "title": "Suez Crisis & Hungarian Uprising",
    "summary": "Crises test Alliance cohesion; NATO focuses on consultation and stability.",
    "meta": {}
  },
  {
    "id": "nato-1957-12-16-paris-declaration",
    "category": "nato",
    "year": 1957,
    "title": "Paris Summit Declaration",
    "summary": "Heads of State and Government affirm collective defence and political consultation.",
    "meta": {}
  },
  {
    "id": "nato-1958-04-01-science-programme",
    "category": "nato",
    "year": 1958,
    "title": "NATO Science Programme launched",
    "summary": "Begins civil science cooperation across Allies.",
    "meta": {}
  },
  {
    "id": "nato-1961-04-12-civil-emergency",
    "category": "nato",
    "year": 1961,
    "title": "Civil Emergency Planning enhanced",
    "summary": "Allies expand civil preparedness and resilience work.",
    "meta": {}
  },
  {
    "id": "nato-1963-12-13-nuclear-planning-group",
    "category": "nato",
    "year": 1966,
    "title": "Nuclear Planning Group formed",
    "summary": "Forum for nuclear policy consultation.",
    "meta": {}
  },
  {
    "id": "nato-1966-03-07-france-withdraws-ids",
    "category": "nato",
    "year": 1966,
    "title": "France withdraws from NATO’s integrated military command",
    "summary": "France remains an Ally but leaves the integrated command structure.",
    "meta": {}
  },
  {
    "id": "nato-1967-10-16-brussels-hq",
    "category": "nato",
    "year": 1967,
    "title": "NATO HQ moves to Brussels",
    "summary": "Alliance political headquarters relocates from Paris to Brussels.",
    "meta": {}
  },
  {
    "id": "nato-1967-12-14-harmel-report",
    "category": "nato",
    "year": 1967,
    "title": "Harmel Report adopted",
    "summary": "Sets dual-track approach of deterrence and détente.",
    "meta": {}
  },
  {
    "id": "nato-1968-08-20-czech-crisis",
    "category": "nato",
    "year": 1968,
    "title": "Warsaw Pact invasion of Czechoslovakia condemned",
    "summary": "NATO consults on security implications.",
    "meta": {}
  },
  {
    "id": "nato-1973-06-22-csce",
    "category": "nato",
    "year": 1973,
    "title": "Support for CSCE process",
    "summary": "Backs negotiations that lead to Helsinki Final Act (1975).",
    "meta": {}
  },
  {
    "id": "nato-1974-08-14-cyprus-crisis",
    "category": "nato",
    "year": 1974,
    "title": "Cyprus crisis strains Allies",
    "summary": "Alliance navigates intra-Allied tensions; focus on de-escalation.",
    "meta": {}
  },
  {
    "id": "nato-1979-05-30-ndp",
    "category": "nato",
    "year": 1979,
    "title": "Long-Term Defence Programme",
    "summary": "Cooperative efforts to strengthen conventional forces.",
    "meta": {}
  },
  {
    "id": "nato-1979-12-12-diid",
    "category": "nato",
    "year": 1979,
    "title": "Dual-Track Decision",
    "summary": "Allies decide to deploy INF missiles while pursuing arms control talks.",
    "meta": {}
  },
  {
    "id": "nato-1982-05-30-spain-joins",
    "category": "nato",
    "year": 1982,
    "title": "Spain joins NATO",
    "summary": "Alliance grows to 16 members.",
    "meta": { "members_added": ["ES"] }
  },
  {
    "id": "nato-1983-09-01-kal007",
    "category": "nato",
    "year": 1983,
    "title": "KAL 007 shootdown response",
    "summary": "Allies coordinate political response; stress air safety.",
    "meta": {}
  },
  {
    "id": "nato-1986-11-21-reykjavik-aftermath",
    "category": "nato",
    "year": 1986,
    "title": "Support for arms control momentum",
    "summary": "Allies back negotiations leading to the INF Treaty.",
    "meta": {}
  },
  {
    "id": "nato-1989-11-09-berlin-wall",
    "category": "nato",
    "year": 1989,
    "title": "Fall of the Berlin Wall",
    "summary": "Historic change reshapes NATO’s strategic environment.",
    "meta": {}
  },
  {
    "id": "nato-1990-07-06-london-declaration",
    "category": "nato",
    "year": 1990,
    "title": "London Declaration",
    "summary": "Allies reach out to former adversaries; NATO transforms.",
    "meta": {}
  },
  {
    "id": "nato-1991-11-08-rome-strategic-concept",
    "category": "nato",
    "year": 1991,
    "title": "New Strategic Concept (Rome)",
    "summary": "First post–Cold War Strategic Concept adopted.",
    "meta": {}
  },
  {
    "id": "nato-1992-12-17-peace-support",
    "category": "nato",
    "year": 1992,
    "title": "Support to UN/EU in Balkans begins",
    "summary": "Maritime and air operations in Adriatic; AWACS over Bosnia.",
    "meta": {}
  },
  {
    "id": "nato-1994-01-10-pfp",
    "category": "nato",
    "year": 1994,
    "title": "Partnership for Peace launched",
    "summary": "Framework for cooperation with non‑Allies.",
    "meta": {}
  },
  {
    "id": "nato-1994-02-28-deny-flight",
    "category": "nato",
    "year": 1994,
    "title": "Operation Deny Flight",
    "summary": "NATO’s first combat operation; enforces no‑fly zone over Bosnia.",
    "meta": {}
  },
  {
    "id": "nato-1995-08-30-deliberate-force",
    "category": "nato",
    "year": 1995,
    "title": "Operation Deliberate Force",
    "summary": "Air strikes against Bosnian Serb targets after Srebrenica.",
    "meta": {}
  },
  {
    "id": "nato-1995-12-20-ifor-bosnia",
    "category": "nato",
    "year": 1995,
    "title": "IFOR deployed to Bosnia and Herzegovina",
    "summary": "Implements the military aspects of the Dayton Peace Agreement.",
    "meta": {}
  },
  {
    "id": "nato-1996-12-20-sfor",
    "category": "nato",
    "year": 1996,
    "title": "SFOR replaces IFOR",
    "summary": "Stabilization Force continues peace implementation in Bosnia.",
    "meta": {}
  },
  {
    "id": "nato-1997-05-27-nato-russia-foundation",
    "category": "nato",
    "year": 1997,
    "title": "NATO–Russia Founding Act",
    "summary": "Establishes framework for relations and the NATO‑Russia Council.",
    "meta": {}
  },
  {
    "id": "nato-1997-05-27-nato-ukraine-charter",
    "category": "nato",
    "year": 1997,
    "title": "NATO–Ukraine Charter signed",
    "summary": "Establishes Distinctive Partnership with Ukraine.",
    "meta": {}
  },
  {
    "id": "nato-1997-07-08-madrid-summit",
    "category": "nato",
    "year": 1997,
    "title": "Madrid Summit",
    "summary": "Invites CZ, HU, PL; launches EAPC.",
    "meta": {}
  },
  {
    "id": "nato-1999-03-12-enlargement-1999",
    "category": "nato",
    "year": 1999,
    "title": "Czech Republic, Hungary, Poland join",
    "summary": "First post–Cold War enlargement.",
    "meta": { "members_added": ["CZ","HU","PL"] }
  },
  {
    "id": "nato-1999-03-24-kosovo-op",
    "category": "nato",
    "year": 1999,
    "title": "Operation Allied Force (Kosovo)",
    "summary": "Air campaign to halt humanitarian catastrophe.",
    "meta": {}
  },
  {
    "id": "nato-1999-04-24-strategic-concept-1999",
    "category": "nato",
    "year": 1999,
    "title": "1999 Strategic Concept",
    "summary": "Updates NATO’s tasks and approach at Washington Summit.",
    "meta": {}
  },
  {
    "id": "nato-2001-09-12-article5",
    "category": "nato",
    "year": 2001,
    "title": "Article 5 invoked after 9/11",
    "summary": "Collective defence clause invoked for the first time.",
    "meta": {}
  },
  {
    "id": "nato-2002-05-28-russia-council",
    "category": "nato",
    "year": 2002,
    "title": "NATO–Russia Council created",
    "summary": "Replaces Permanent Joint Council; meets at 20.",
    "meta": {}
  },
  {
    "id": "nato-2002-11-21-prague-capabilities",
    "category": "nato",
    "year": 2002,
    "title": "Prague Summit",
    "summary": "NATO Response Force; Prague Capabilities Commitment.",
    "meta": {}
  },
  {
    "id": "nato-2003-08-11-isaf",
    "category": "nato",
    "year": 2003,
    "title": "NATO assumes command of ISAF (Afghanistan)",
    "summary": "Alliance leads UN‑mandated mission in Kabul, later across Afghanistan.",
    "meta": {}
  },
  {
    "id": "nato-2003-06-12-iraq-assistance",
    "category": "nato",
    "year": 2004,
    "title": "NATO Training Mission–Iraq announced",